{
  "name": "Aisha Rahman",
  "phone": "07700 900123",
  "email": "aisha.rahman@example.co.uk",
  "address": "14 Kirkgate, Leeds LS2 7DJ",
  "dob": null,
  "cardNo": "LC000123",
  "balance": 0.00,
  "points": 240,
  "creditLimit": 0.00,
  "tier": "Silver",
  "notes": "",
  "isActive": true,
  "anonymisedAt": null,
  "isAnonymised": false,
  "id": "01K5T0Q8C4000000000000K001",
  "companyId": "01K5T0Q8C4000000000000C001",
  "createdAt": "2026-09-01T08:00:00Z",
  "updatedAt": "2026-09-01T08:00:00Z",
  "rowVersion": 1,
  "deletedAt": null,
  "isDeleted": false,
  "domainEvents": []
}
